Automatic roots for Google#NNI??-----A---?:	go gůgl Go
Manual roots for Google#NNI??-----A---?:	
--

Automatic roots for Hay#NNM??-----A---?:	Háj Hay Hajek Hayek hayek háj haj
Manual roots for Hay#NNM??-----A---?:	
--

Automatic roots for Ind#NNM??-----A---?:	indic Ind indičt Indi indijsk indizova indizace
Manual roots for Ind#NNM??-----A---?:	
--

Automatic roots for Lazar#NNM??-----A---?:	Laz Lazar Lazarus lazar lazaret lazarsk lazark lazarist
Manual roots for Lazar#NNM??-----A---?:	
--

Automatic roots for Marx#NNM??-----A---?:	marxist Marx marx marxizmus marxismus
Manual roots for Marx#NNM??-----A---?:	
--

Automatic roots for Matouš#NNM??-----A---?:	Matouš matěj Matěj mates Matě matě Mate mate Mates
Manual roots for Matouš#NNM??-----A---?:	
--

Automatic roots for Mikuláš#NNM??-----A---?:	Mikuláš Mikeš mikuláš Mikul Mike Mikešk Mik
Manual roots for Mikuláš#NNM??-----A---?:	
--

Automatic roots for Pasteur#NNM??-----A---?:	paster pasterizova pasteur Pasteu Pasteur pasterizace pasteriza pasterizová pasterac pasterač
Manual roots for Pasteur#NNM??-----A---?:	
--

Automatic roots for Platon#NNM??-----A---?:	platon platón Platon Platón platonič platonik platonismus
Manual roots for Platon#NNM??-----A---?:	
--

Automatic roots for Ukrajina#NNF??-----A---?:	krajin krajinc krajinsk krajinštin krajinistik
Manual roots for Ukrajina#NNF??-----A---?:	
--

Automatic roots for anarchie#NNF??-----A---?:	anarchist anarchizova anarchic anarch anarchič anarchiz anarchizmus anarchismus
Manual roots for anarchie#NNF??-----A---?:	
--

Automatic roots for angažovat#V????--??-??I??:	angaž angažm
Manual roots for angažovat#V????--??-??I??:	
--

Automatic roots for aplikovat#V????--??-??B??:	aplik aplikač a
Manual roots for aplikovat#V????--??-??B??:	
--

Automatic roots for artikule#NNFP?-----A---?:	artikul artikulač
Manual roots for artikule#NNFP?-----A---?:	
--

Automatic roots for barbar#NNM??-----A---?:	barbar barbarizmus barbarismus barbark barbarizace barbariz barbarstv
Manual roots for barbar#NNM??-----A---?:	
--

Automatic roots for barikáda#NNF??-----A---?:	barikád barikádn barik
Manual roots for barikáda#NNF??-----A---?:	
--

Automatic roots for beseda#NNF??-----A---?:	besed besíd besídeč
Manual roots for beseda#NNF??-----A---?:	
--

Automatic roots for blok#NNI??-----A---?:	blok blo blokař blokařk bloč bločk
Manual roots for blok#NNI??-----A---?:	
--

Automatic roots for blond#AAXXX----1A----:	blonď blondýn blond bloňď blon blondýnk blonck
Manual roots for blond#AAXXX----1A----:	
--

Automatic roots for bláto#NNN??-----A---?:	blát blat blác
Manual roots for bláto#NNN??-----A---?:	
--

Automatic roots for brak#NNI??-----A---?:	brak
Manual roots for brak#NNI??-----A---?:	
--

Automatic roots for brebentit#V????--??-??I??:	brebent
Manual roots for brebentit#V????--??-??I??:	
--

Automatic roots for bé#NNNXX-----A----:	beč béč béčk bé
Manual roots for bé#NNNXX-----A----:	
--

Automatic roots for bříza#NNF??-----A---?:	břez bříz březň březe
Manual roots for bříza#NNF??-----A---?:	
--

Automatic roots for chlopeň#NNF??-----A---?:	chlíp chlip chlop chlopen chlopň
Manual roots for chlopeň#NNF??-----A---?:	
--

Automatic roots for cifra#NNF??-----A---?:	cifr cifern cifrová cifruj
Manual roots for cifra#NNF??-----A---?:	
--

Automatic roots for cihla#NNF??-----A---?:	cihl cihlář cihel ciheln cihlovit cihlič cihličk
Manual roots for cihla#NNF??-----A---?:	
--

Automatic roots for cumlat#V????--??-??I??:	cuml cumla cumláv cumlá cumlac cumlaj cumlav
Manual roots for cumlat#V????--??-??I??:	
--

Automatic roots for cídit#V????--??-??I??:	cíd cidírn cídírn
Manual roots for cídit#V????--??-??I??:	
--

Automatic roots for deptat#V????--??-??I??:	dept depta deptaj
Manual roots for deptat#V????--??-??I??:	
--

Automatic roots for devalvovat#V????--??-??B??:	valv devalvač valvace
Manual roots for devalvovat#V????--??-??B??:	
--

Automatic roots for drama#NNN??-----A---?:	dramaturg dram dramatič dramaturgick dramati dramatik dramaturgi dramaturgyn
Manual roots for drama#NNN??-----A---?:	
--

Automatic roots for druh#NNM??-----A---?:	druh druž dru
Manual roots for druh#NNM??-----A---?:	
--

Automatic roots for etapa#NNF??-----A---?:	etap etapizova etapovit etapizace etapizová
Manual roots for etapa#NNF??-----A---?:	
--

Automatic roots for farma#NNF??-----A---?:	farm farem farmař
Manual roots for farma#NNF??-----A---?:	
--

Automatic roots for handicap#NNI??-----A---?:	handicap hendikep handikep handicapuj hendikepuj
Manual roots for handicap#NNI??-----A---?:	
--

Automatic roots for hierarchie#NNF??-----A---?:	hierarchizova hiearchic hierarchic hierarchiz hierarchi hierarchič hierarchizová
Manual roots for hierarchie#NNF??-----A---?:	
--

Automatic roots for hodina#NNF??-----A---?:	hodin hodink hodinař hoď
Manual roots for hodina#NNF??-----A---?:	
--

Automatic roots for homogenní#AA???----??---?:	homogen homogeniza
Manual roots for homogenní#AA???----??---?:	
--

Automatic roots for houf#NNI??-----A---?:	houf houfec houfek
Manual roots for houf#NNI??-----A---?:	
--

Automatic roots for hrozen#NNI??-----A---?:	hroz roz Hroz
Manual roots for hrozen#NNI??-----A---?:	
--

Automatic roots for hruška#NNF??-----A---?:	hruš Hruš hruštičk hrušeck hruštič
Manual roots for hruška#NNF??-----A---?:	
--

Automatic roots for huba#NNF??-----A---?:	hub
Manual roots for huba#NNF??-----A---?:	
--

Automatic roots for huhlat#V????--??-??I??:	huhl huhla huhlaj
Manual roots for huhlat#V????--??-??I??:	
--

Automatic roots for humor#NNI??-----A---?:	humorist humorn humor humoresk humorál humoriád humork
Manual roots for humor#NNI??-----A---?:	
--

Automatic roots for intenzivní#AA???----??---?:	intenziv intenzív intensiv intensív zintensiv intenz
Manual roots for intenzivní#AA???----??---?:	
--

Automatic roots for intervenovat#V????--??-??B??:	interven intervencion inter intervent intervencionismus
Manual roots for intervenovat#V????--??-??B??:	
--

Automatic roots for inventář#NNI??-----A---?:	inventar inventur invent inventár inventariza inventariz
Manual roots for inventář#NNI??-----A---?:	
--

Automatic roots for jediný#AA???----1?---?:	jedin jedináč jedineč jediněl jedinc jedine
Manual roots for jediný#AA???----1?---?:	
--

Automatic roots for ještěr#NNM??-----A---?:	ještěr ještěrk ještěř
Manual roots for ještěr#NNM??-----A---?:	
--

Automatic roots for jíl#NNI??-----A---?:	jíl
Manual roots for jíl#NNI??-----A---?:	
--

Automatic roots for konsolidovat#V????--??-??B??:	konsolid kon konsolidač konzolidace konzolid
Manual roots for konsolidovat#V????--??-??B??:	
--

Automatic roots for kontingence#NNF??-----A---?:	kontinent kontingent kontinentál kontingen kontingenc kontinental kontingentace
Manual roots for kontingence#NNF??-----A---?:	
--

Automatic roots for kotit#V???---??-??I??:	kot koc kocen kotěn ko
Manual roots for kotit#V???---??-??I??:	
--

Automatic roots for kroupa#NNF??-----A---?:	krup kroup kroupovk
Manual roots for kroupa#NNF??-----A---?:	
--

Automatic roots for kur#NNM??-----A---?:	kur kuř Kuřát kurníče kuřát Kuřátk kuřinec kuřic
Manual roots for kur#NNM??-----A---?:	
--

Automatic roots for kurz#NNI??-----A---?:	kurs kurz kur kurzist kursist kurzov kurzovn
Manual roots for kurz#NNI??-----A---?:	
--

Automatic roots for kurýr#NNM??-----A---?:	kurýr kurýrk kurýruj kurýrsk
Manual roots for kurýr#NNM??-----A---?:	
--

Automatic roots for kymácet#V????--??-??I??:	kymác
Manual roots for kymácet#V????--??-??I??:	
--

Automatic roots for kyt#NNI??-----A---?:	kyt
Manual roots for kyt#NNI??-----A---?:	
--

Automatic roots for křeček#NNM??-----A---?:	křečk křeč Křečk Křeč křečic křečík
Manual roots for křeček#NNM??-----A---?:	
--

Automatic roots for licitovat#V????--??-??I??:	licit licitač licitac
Manual roots for licitovat#V????--??-??I??:	
--

Automatic roots for lišta#NNF??-----A---?:	lišt
Manual roots for lišta#NNF??-----A---?:	
--

Automatic roots for lupat#V????--??-??I??:	lup loup
Manual roots for lupat#V????--??-??I??:	
--

Automatic roots for manifest#NNI??-----A---?:	manifest manifestač manifestant mani manifestace
Manual roots for manifest#NNI??-----A---?:	
--

Automatic roots for mašírovat#V????--??-??I??:	mašír
Manual roots for mašírovat#V????--??-??I??:	
--

Automatic roots for mini#AAXXX----1A----:	miniatur min miniaturist miniaturiza miniaturiz miniaturn
Manual roots for mini#AAXXX----1A----:	
--

Automatic roots for moneta#NNF??-----A---?:	monet monetarist monetár monetarizmus monetarismus monetar
Manual roots for moneta#NNF??-----A---?:	
--

Automatic roots for odeslat#V????--??-??P??:	ode
Manual roots for odeslat#V????--??-??P??:	
--

Automatic roots for odolat#V????--??-??P??:	dol dola doln doláv
Manual roots for odolat#V????--??-??P??:	
--

Automatic roots for okupovat#V????--??-??I??:	o okupač okup okupantsk
Manual roots for okupovat#V????--??-??I??:	
--

Automatic roots for olovo#NNN??-----A---?:	olovnat olověn olov olovičit olovnic olůvk tetraetylol
Manual roots for olovo#NNN??-----A---?:	
--

Automatic roots for orient#NNI??-----A---?:	oriental orientál orient
Manual roots for orient#NNI??-----A---?:	
--

Automatic roots for otec#NNM??-----A---?:	ot otc otec oteck otčím ote
Manual roots for otec#NNM??-----A---?:	
--

Automatic roots for paleta#NNF??-----A---?:	palet paleť
Manual roots for paleta#NNF??-----A---?:	
--

Automatic roots for paralyzovat#V????--??-??B??:	paralyz paralyt para paralyzér paralýz
Manual roots for paralyzovat#V????--??-??B??:	
--

Automatic roots for peklo#NNN??-----A---?:	pekl pekeln pekelnic peklit pekel pekelník pek
Manual roots for peklo#NNN??-----A---?:	
--

Automatic roots for penze#NNF??-----A---?:	penz penzion penzist penzijn pensijn pensist
Manual roots for penze#NNF??-----A---?:	
--

Automatic roots for plesat#V????--??-??I??:	ples maturák
Manual roots for plesat#V????--??-??I??:	
--

Automatic roots for plevel#NNI??-----A---?:	plevel pleve plevíl
Manual roots for plevel#NNI??-----A---?:	
--

Automatic roots for plundra#NNF??-----A---?:	plundr plundruj
Manual roots for plundra#NNF??-----A---?:	
--

Automatic roots for poltit#V????--??-??I??:	polt polcen poltěn polc polcuj
Manual roots for poltit#V????--??-??I??:	
--

Automatic roots for porouchat#V????--??-??P??:	rouch ruch
Manual roots for porouchat#V????--??-??P??:	
--

Automatic roots for praktikovat#V????--??-??I??:	praktik praktikant praktikum praktikantsk praktikantstv
Manual roots for praktikovat#V????--??-??I??:	
--

Automatic roots for princ#NNM??-----A---?:	principál princez princ princeznič princát
Manual roots for princ#NNM??-----A---?:	
--

Automatic roots for profesor#NNM??-----A---?:	profesor próf profes profesorčin profesorová profesoruj professor profesur profesůr
Manual roots for profesor#NNM??-----A---?:	
--

Automatic roots for prvý#AA???----1?---?:	prv
Manual roots for prvý#AA???----1?---?:	
--

Automatic roots for prznit#V????--??-??I??:	prz przn przněn przň przni
Manual roots for prznit#V????--??-??I??:	
--

Automatic roots for práh#NNI??-----A---?:	prah praž pražc prá
Manual roots for práh#NNI??-----A---?:	
--

Automatic roots for puberta#NNF??-----A---?:	pubert puberť puberťák
Manual roots for puberta#NNF??-----A---?:	
--

Automatic roots for pánbůh#NNM??-----A---?:	pám pán pambíčk panbíčk pánbůh pánb
Manual roots for pánbůh#NNM??-----A---?:	
--

Automatic roots for příroda#NNF??-----A---?:	přiroz přírod přírodnin
Manual roots for příroda#NNF??-----A---?:	
--

Automatic roots for rasa#NNF??-----A---?:	rasist ras rasismus
Manual roots for rasa#NNF??-----A---?:	
--

Automatic roots for reklamovat#V????--??-??I??:	klam klamant reklamač
Manual roots for reklamovat#V????--??-??I??:	
--

Automatic roots for remíza#NNF??-----A---?:	remizova remíz remis remizová remiz rimes
Manual roots for remíza#NNF??-----A---?:	
--

Automatic roots for renta#NNF??-----A---?:	rent rentiér rentabil rentabiln
Manual roots for renta#NNF??-----A---?:	
--

Automatic roots for rentgen#NNI??-----A---?:	rentgen
Manual roots for rentgen#NNI??-----A---?:	
--

Automatic roots for reportáž#NNF??-----A---?:	reportér fotoreportér report reportáž fotoreport
Manual roots for reportáž#NNF??-----A---?:	
--

Automatic roots for role#NNF??-----A---?:	rol rul rolnic rolnictv rolič rolnič rolník
Manual roots for role#NNF??-----A---?:	
--

Automatic roots for rošt#NNI??-----A---?:	rošt roštěn roštěnk
Manual roots for rošt#NNI??-----A---?:	
--

Automatic roots for saně#NNFP?-----A---?:	sáň san sanic
Manual roots for saně#NNFP?-----A---?:	
--

Automatic roots for segment#NNI??-----A---?:	segment segmenta segmentál seg segmentace
Manual roots for segment#NNI??-----A---?:	
--

Automatic roots for sentiment#NNI??-----A---?:	sentimental sentimentál sentiment sentimentalismus
Manual roots for sentiment#NNI??-----A---?:	
--

Automatic roots for silo#NNN??-----A---?:	siláž silo
Manual roots for silo#NNN??-----A---?:	
--

Automatic roots for skript#NNI??-----A---?:	skript script
Manual roots for skript#NNI??-----A---?:	
--

Automatic roots for smeč#NNF??-----A---?:	smeč smečař
Manual roots for smeč#NNF??-----A---?:	
--

Automatic roots for soused#NNM??-----A---?:	sou soused sousedovic
Manual roots for soused#NNM??-----A---?:	
--

Automatic roots for spláchnout#V????--??-??P??:	plach plách splaš plaš
Manual roots for spláchnout#V????--??-??P??:	
--

Automatic roots for stěna#NNF??-----A---?:	stěn stěnk stě
Manual roots for stěna#NNF??-----A---?:	
--

Automatic roots for surový#AA???----??---?:	sur
Manual roots for surový#AA???----??---?:	
--

Automatic roots for taxi#NNNXX-----A----:	taxík taxikář taxikař tax taxik taxikařin taxí taxíč
Manual roots for taxi#NNNXX-----A----:	
--

Automatic roots for temperovat#V????--??-??I??:	temper temperace temperač temperatur
Manual roots for temperovat#V????--??-??I??:	
--

Automatic roots for tolerovat#V????--??-??I??:	toler tolerant tolerance toleranč
Manual roots for tolerovat#V????--??-??I??:	
--

Automatic roots for totožný#A????----??---?:	totož to totožn totožň totožněn
Manual roots for totožný#A????----??---?:	
--

Automatic roots for trakce#NNF??-----A---?:	traktorist traktorov trak trakc trakto traktorář traktorek traktork traktůr traktůrk traktoriád minitraktor trač
Manual roots for trakce#NNF??-----A---?:	
--

Automatic roots for trocha#NNF??-----A----:	troškař troch trošink troš trošič trošk troška trošíč trošín
Manual roots for trocha#NNF??-----A----:	
--

Automatic roots for trčet#V????--??-??I??:	trč
Manual roots for trčet#V????--??-??I??:	
--

Automatic roots for tvářit#V????--??-??I??:	tvář tvař
Manual roots for tvářit#V????--??-??I??:	
--

Automatic roots for túra#NNF??-----A---?:	túr turist turistik túruj
Manual roots for túra#NNF??-----A---?:	
--

Automatic roots for vata#NNF??-----A---?:	vat vatovit va vatičk vatovec
Manual roots for vata#NNF??-----A---?:	
--

Automatic roots for vepř#NNM??-----A---?:	vepř vepří vepřenk vepřinec vepřík vepřín
Manual roots for vepř#NNM??-----A---?:	
--

Automatic roots for vokál#NNI??-----A---?:	vokal vok
Manual roots for vokál#NNI??-----A---?:	
--

Automatic roots for vrba#NNF??-----A---?:	vrb vrbin vrbk
Manual roots for vrba#NNF??-----A---?:	
--

Automatic roots for vymezit#V????--??-??P??:	mez mezen
Manual roots for vymezit#V????--??-??P??:	
--

Automatic roots for vymyslet#V??????????????:	mýšl mysl mýšlen myšl mýšlej mýšlitel mýšliv
Manual roots for vymyslet#V??????????????:	
--

Automatic roots for zabíhat#V????--??-??I??:	běh bíh běhl bě záběh
Manual roots for zabíhat#V????--??-??I??:	
--

Automatic roots for zbroj#NNF??-----A---?:	zbro zbroj zbrojař zbrojíř zbrojařin zbrojnic zbrojovn
Manual roots for zbroj#NNF??-----A---?:	
--

Automatic roots for zdolat#V????--??-??P??:	dol dola doln doláv
Manual roots for zdolat#V????--??-??P??:	
--

Automatic roots for zdát#V????--??-??I??:	dá dánl da dajíc dan dáv
Manual roots for zdát#V????--??-??I??:	
--

Automatic roots for zvíře#NNN??-----A---?:	zvíř zviř zvířetník
Manual roots for zvíře#NNN??-----A---?:	
--

Automatic roots for česnek#NNI??-----A---?:	česnek česn česne česnečk česnáč
Manual roots for česnek#NNI??-----A---?:	
--

Automatic roots for Řím#NNI??-----A---?:	řím Řím Říman říman
Manual roots for Řím#NNI??-----A---?:	
--

Automatic roots for říhat#V????--??-??I??:	říh
Manual roots for říhat#V????--??-??I??:	
--

Automatic roots for šablona#NNF??-----A---?:	šablon šablonovit
Manual roots for šablona#NNF??-----A---?:	
--

Automatic roots for škaredý#AA???----??---?:	škared
Manual roots for škaredý#AA???----??---?:	
--

Automatic roots for štep#NNI??-----A---?:	štep
Manual roots for štep#NNI??-----A---?:	
--

Automatic roots for štrachat#V????--??-??I??:	štrach štrách
Manual roots for štrachat#V????--??-??I??:	
--

Automatic roots for šuškat#V????--??-??I??:	šušk šuška šuškand
Manual roots for šuškat#V????--??-??I??:	
--

Automatic roots for šálit#V????--??-??I??:	šál šaleb šalb
Manual roots for šálit#V????--??-??I??:	
--

Automatic roots for želé#NNNXX-----A----:	žel želír
Manual roots for želé#NNNXX-----A----:	
--

Automatic roots for žák#NNM??-----A---?:	žák žač žá žáč žactv žákyn
Manual roots for žák#NNM??-----A---?:	
--

Automatic roots for Irán#NNI??-----A---?:	írán Írán Irán irán Iránc Íránc severoírán
Manual roots for Irán#NNI??-----A---?:	
--

Automatic roots for Katarina#NNF??-----A---?:	Kateřin Katarin Katarín Katerin Kat Katerynin Kateryn Kač Kačen kateřin
Manual roots for Katarina#NNF??-----A---?:	
--

Automatic roots for Luter#NNM??-----A---?:	luterán Luter luter Luther luther luterá luteran lutherán
Manual roots for Luter#NNM??-----A---?:	
--

Automatic roots for Olympie#NNF??-----A---?:	lympij lympionik lympi lympiád olympiad bio lympioni lympionič lympič
Manual roots for Olympie#NNF??-----A---?:	
--

Automatic roots for Sion#NNI??-----A---?:	sion Sion Sión sionismus sión
Manual roots for Sion#NNI??-----A---?:	
--

Automatic roots for Slovan#NNM??-----A---?:	sl Slovan slovan slovanstv Slova Slovank slovansk slovanštin
Manual roots for Slovan#NNM??-----A---?:	
--

Automatic roots for Wagner#NNM??-----A---?:	wagnerián wagner Wagner wagnerizmus wagnerismus wagneriá wagnerian wagnerianismus
Manual roots for Wagner#NNM??-----A---?:	
--

Automatic roots for Wales#NNI??-----A---?:	Wales wales Wal elša elšank Welšank elšan Walesa Walesan elš elšsk waleštin welš welšsk
Manual roots for Wales#NNI??-----A---?:	
--

Automatic roots for akceptovat#V????--??-??B??:	akcept akceptace akceptabiln akcepta akceptant akceptor
Manual roots for akceptovat#V????--??-??B??:	
--

Automatic roots for alarm#NNI??-----A---?:	alarm alarmist alarmizmus alarmismus
Manual roots for alarm#NNI??-----A---?:	
--

Automatic roots for arbitr#NNM??-----A---?:	arbitr arbitrár arbitráž arbitrá
Manual roots for arbitr#NNM??-----A---?:	
--

Automatic roots for archaický#AA???----??---?:	archaist archaic arch archaizova archaick archaikum archaizmus archaismus archaizac archaizová archaiz
Manual roots for archaický#AA???----??---?:	
--

Automatic roots for balet#NNI??-----A---?:	balet balerín balerin bale
Manual roots for balet#NNI??-----A---?:	
--

Automatic roots for bigbeat#NNI??-----A---?:	bigbeat bigbíť bigbít bigbeať bigbeaťák bigboš bigb
Manual roots for bigbeat#NNI??-----A---?:	
--

Automatic roots for biologie#NNF??-----A---?:	biologick biolog biolo biolož biologi biologizac biologizmus
Manual roots for biologie#NNF??-----A---?:	
--

Automatic roots for bouda#NNF??-----A---?:	boud bud budk búd
Manual roots for bouda#NNF??-----A---?:	
--

Automatic roots for burácet#V????--??-??I??:	bur burác
Manual roots for burácet#V????--??-??I??:	
--

Automatic roots for břinkat#V????--??-??I??:	břink břinkačk
Manual roots for břinkat#V????--??-??I??:	
--

Automatic roots for celebrovat#V????--??-??I??:	celebr celebrit celebruj celebrace celebran celebrant
Manual roots for celebrovat#V????--??-??I??:	
--

Automatic roots for cuknout#V????--??-??P??:	cuk
Manual roots for cuknout#V????--??-??P??:	
--

Automatic roots for dekret#NNI??-----A---?:	dekret dekretist
Manual roots for dekret#NNI??-----A---?:	
--

Automatic roots for derivovat#V????--??-??I??:	deriv derivač derivát derivace
Manual roots for derivovat#V????--??-??I??:	
--

Automatic roots for design#NNI??-----A---?:	design designer designér designerčin
Manual roots for design#NNI??-----A---?:	
--

Automatic roots for diagnostika#NNF??-----A---?:	diagnostik diagnóz diagnost dia diagnosti
Manual roots for diagnostika#NNF??-----A---?:	
--

Automatic roots for disciplína#NNF??-----A---?:	disciplin disciplín transdisciplin
Manual roots for disciplína#NNF??-----A---?:	
--

Automatic roots for distanc#NNI??-----A---?:	distanc distanč dist distant dištanc
Manual roots for distanc#NNI??-----A---?:	
--

Automatic roots for doutnat#V????--??-??I??:	ut utnák
Manual roots for doutnat#V????--??-??I??:	
--

Automatic roots for drnčet#V????--??-??I??:	drnč drnčák
Manual roots for drnčet#V????--??-??I??:	
--

Automatic roots for dvojnásobek#NNI??-----A---?:	dvojnásob dvounásob dvoj
Manual roots for dvojnásobek#NNI??-----A---?:	
--

Automatic roots for ethika#NNF??-----A---?:	etic ethik ethic etič etizova etiz zetis etizová ét eti etik
Manual roots for ethika#NNF??-----A---?:	
--

Automatic roots for exhibice#NNF??-----A---?:	exhibicion exhib exhibič exhibic exhibicionismus ex
Manual roots for exhibice#NNF??-----A---?:	
--

Automatic roots for extrahovat#V????--??-??B??:	trah extrak trakce traktor trak trakt traktiv
Manual roots for extrahovat#V????--??-??B??:	
--

Automatic roots for fajfka#NNF??-----A---?:	fajfk fajfková fajf fajfčič
Manual roots for fajfka#NNF??-----A---?:	
--

Automatic roots for feminizmus#NNI??-----A---?:	feminist femin feminismus
Manual roots for feminizmus#NNI??-----A---?:	
--

Automatic roots for flik#NNI??-----A---?:	flik
Manual roots for flik#NNI??-----A---?:	
--

Automatic roots for flusnout#V????--??-??P??:	flus flusn
Manual roots for flusnout#V????--??-??P??:	
--

Automatic roots for froté#AAXXX----1A----:	frotýr frotáž frot frotér froť
Manual roots for froté#AAXXX----1A----:	
--

Automatic roots for gratulovat#V????--??-??I??:	gratul gratulace
Manual roots for gratulovat#V????--??-??I??:	
--

Automatic roots for hráz#NNF??-----A---?:	hráz
Manual roots for hráz#NNF??-----A---?:	
--

Automatic roots for huť#NNF??-----A---?:	hut huť hutnič hutn
Manual roots for huť#NNF??-----A---?:	
--

Automatic roots for ironie#NNF??-----A---?:	iron ironič ironik
Manual roots for ironie#NNF??-----A---?:	
--

Automatic roots for kacéř#NNM??-----A---?:	kacíř kacéř kaceř
Manual roots for kacéř#NNM??-----A---?:	
--

Automatic roots for kaskáda#NNF??-----A---?:	kaskadér kaskád kaskádovit
Manual roots for kaskáda#NNF??-----A---?:	
--

Automatic roots for kdák#NNI??-----A---?:	kdák
Manual roots for kdák#NNI??-----A---?:	
--

Automatic roots for kluk#NNM??-----A---?:	kluk kluč klouč klu klouče klučin klučisk
Manual roots for kluk#NNM??-----A---?:	
--

Automatic roots for koks#NNI??-----A---?:	koks koksov koksáren koksař koksuj koksovn koksár
Manual roots for koks#NNI??-----A---?:	
--

Automatic roots for komplement#NNI??-----A---?:	komplement komplementár komplementace komplementarit
Manual roots for komplement#NNI??-----A---?:	
--

Automatic roots for kondice#NNF??-----A---?:	kondič kondicion kondic kondici kondicionace
Manual roots for kondice#NNF??-----A---?:	
--

Automatic roots for konflikt#NNI??-----A---?:	konflikt minikonflikt
Manual roots for konflikt#NNI??-----A---?:	
--

Automatic roots for kov#NNI??-----A---?:	kov kovi koven kovnatost kovová
Manual roots for kov#NNI??-----A---?:	
--

Automatic roots for krnět#V????--??-??I??:	krn krněl krň
Manual roots for krnět#V????--??-??I??:	
--

Automatic roots for kulisa#NNF??-----A---?:	kulis kulisovit kulisák kul
Manual roots for kulisa#NNF??-----A---?:	
--

Automatic roots for kvílet#V????--??-??I??:	kvíl
Manual roots for kvílet#V????--??-??I??:	
--

Automatic roots for lidštit#Vf--------A----:	lidšt lidšť lid lidštěn
Manual roots for lidštit#Vf--------A----:	
--

Automatic roots for lopata#NNF??-----A---?:	lop lopat lopatk lopatič
Manual roots for lopata#NNF??-----A---?:	
--

Automatic roots for lopotit#V????--??-??I??:	lopot lopocen lopo lopotěn
Manual roots for lopotit#V????--??-??I??:	
--

Automatic roots for lázeň#NNF??-----A---?:	láz lazeb lazebnic lazebnič lazebnictv
Manual roots for lázeň#NNF??-----A---?:	
--

Automatic roots for maloměsto#NNN??-----A---?:	malo malomest
Manual roots for maloměsto#NNN??-----A---?:	
--

Automatic roots for mohutný#AA???----??---?:	mohut moh mohutň
Manual roots for mohutný#AA???----??---?:	
--

Automatic roots for namrzat#V????--??-??I??:	mrz mrzl mraz mrzá mra námrazek
Manual roots for namrzat#V????--??-??I??:	
--

Automatic roots for naturální#AA???----??---?:	natural na natur tural
Manual roots for naturální#AA???----??---?:	
--

Automatic roots for negativní#AA???----??---?:	negat negativ
Manual roots for negativní#AA???----??---?:	
--

Automatic roots for nikl#NNI??-----A---?:	nikl ni nikluj
Manual roots for nikl#NNI??-----A---?:	
--

Automatic roots for nora#NNF??-----A---?:	nor nork nore noruj
Manual roots for nora#NNF??-----A---?:	
--

Automatic roots for obilí#NNN??-----A---?:	obiln obil obilnin obilovin obilnic ob
Manual roots for obilí#NNN??-----A---?:	
--

Automatic roots for okřát#V????--??-??P??:	okř o okřá okří okřát
Manual roots for okřát#V????--??-??P??:	
--

Automatic roots for opět#Db-------------:	o opět
