Automatic roots for myslit#V????--??-??I??:	mysl myšl myšlen mysln mýšl myšlenk mýšlen nadsmysln mýšlej myšlénk mýšliv mejšle nadpo mejšlen veledůmysln myšlén myšleneč mýšle myslní myslnic myslník
Manual roots for myslit#V????--??-??I??:	
--

Automatic roots for rušit#V????--??-??I??:	ruš naruš ruch zrůš
Manual roots for rušit#V????--??-??I??:	
--

Automatic roots for topit#V????--??-??I??:	táp topen top tá topov to topink potápěč topič topova topn tápěč táplic tápn podlah topidl topí topenec topek topová topuj
Manual roots for topit#V????--??-??I??:	
--

Automatic roots for ouplný#AA???----??---?:	pln plň biodo plněn plni
Manual roots for ouplný#AA???----??---?:	
--

Automatic roots for kousnout#V????--??-??P??:	kous kus kousk kousn kousl kuseče kusk
Manual roots for kousnout#V????--??-??P??:	
--

Automatic roots for stihat#V????--??-??I??:	stih stiž stíh stihuj sti stíž stihač dostih stihaj stihatel stihovk stihn
Manual roots for stihat#V????--??-??I??:	
--

Automatic roots for umět#V????--??-??I??:	um umětel uměl u rozumek umi umělk
Manual roots for umět#V????--??-??I??:	
--

Automatic roots for vládnout#V????--??-??I??:	vlád vlad vladař vladyk vladač ovlád vladyc vlady
Manual roots for vládnout#V????--??-??I??:	
--

Automatic roots for vrhnout#V????--??-??P??:	vrh vr vržl vrhl vržišt
Manual roots for vrhnout#V????--??-??P??:	
--

Automatic roots for hlédat#V????--??-??I??:	hléd hlíd hlíž hled hliž hle hledn
Manual roots for hlédat#V????--??-??I??:	
--

Automatic roots for hořet#V???---??-??I??:	hoř hořl hořel har hořelec hořák harčin hořa
Manual roots for hořet#V???---??-??I??:	
--

Automatic roots for čůrat#V????--??-??I??:	čur čůrá čůra čůr čůráv čůrán čůran čurk čuráč čúrek čůrac čůraj
Manual roots for čůrat#V????--??-??I??:	
--

Automatic roots for kládat#V????--??-??I??:	klád klad ob roz u
Manual roots for kládat#V????--??-??I??:	
--

Automatic roots for oko#NNF??-----A----:	oč ok o oboč obočíč kounk očn očnic očadl
Manual roots for oko#NNF??-----A----:	
--

Automatic roots for realný#AA???----??---?:	real reál realn realismus surreal realiza irreál surrrealismus realisač reeln
Manual roots for realný#AA???----??---?:	
--

Automatic roots for brzdit#V????--??-??I??:	brzd brzď bržd bržď brzděn brzdov
Manual roots for brzdit#V????--??-??I??:	
--

Automatic roots for lovit#V????--??-??I??:	lov love lovč loveče lo vkol
Manual roots for lovit#V????--??-??I??:	
--

Automatic roots for seknout#V????--??-??P??:	sek se seč výsek úsek seck sec sečn sečk sekl zásek
Manual roots for seknout#V????--??-??P??:	
--

Automatic roots for chroupat#V????--??-??I??:	chrup chroup chřup chřoup
Manual roots for chroupat#V????--??-??I??:	
--

Automatic roots for lámat#V????--??-??I??:	lám lam lamač lamačsk lo polom
Manual roots for lámat#V????--??-??I??:	
--

Automatic roots for zář#NNF??-----A---?:	zář zař nicnevy
Manual roots for zář#NNF??-----A---?:	
--

Automatic roots for kora#NNF??-----A---?:	kor kůr korň kůrovc korovit kůrk korn koral korovnice korove korovc kůrove korni koř
Manual roots for kora#NNF??-----A---?:	
--

Automatic roots for plivnout#V????--??-??P??:	pliv plí ple plečk pleč plij plit
Manual roots for plivnout#V????--??-??P??:	
--

Automatic roots for štípnout#V????--??-??P??:	štíp štip štipová štipkář štipuj štipk štipe štipkuj štipeč
Manual roots for štípnout#V????--??-??P??:	
--

Automatic roots for péro#NNN??-----A---?:	pér peř per péř pír peřen peřovit peřenc
Manual roots for péro#NNN??-----A---?:	
--

Automatic roots for chválit#V????--??-??I??:	chval chvál
Manual roots for chválit#V????--??-??I??:	
--

Automatic roots for celý#AA???----??---?:	cel celk celistv celen celkem jitrocel
Manual roots for celý#AA???----??---?:	
--

Automatic roots for blokovat#V????--??-??I??:	blok blokád blokač blokace blokac bloka
Manual roots for blokovat#V????--??-??I??:	
--

Automatic roots for mír#NNI??-----A---?:	miř míř mír mířl smiřl mírn říměř mí smiř Vladimír
Manual roots for mír#NNI??-----A---?:	
--

Automatic roots for podobat#V????--??-??I??:	dob dobova dobň dobenk dobiz doben dobová
Manual roots for podobat#V????--??-??I??:	
--

Automatic roots for den#NNI??-----A---?:	den de dnes deník dneš dneska denič dn denoden deničin denk
Manual roots for den#NNI??-----A---?:	
--

Automatic roots for majstr#NNM??-----A---?:	mistr mistryn majstr po garážmistr mistrn exmistr exmistryn minimistr mistř poštmistr
Manual roots for majstr#NNM??-----A---?:	
--

Automatic roots for prostý#A????----??---?:	pro prost prošť prostěn prostin prostince prostink zesprostač
Manual roots for prostý#A????----??---?:	
--

Automatic roots for čarovat#V????--??-??I??:	čar
Manual roots for čarovat#V????--??-??I??:	
--

Automatic roots for ploužit#V????--??-??I??:	pluh pluž plouž plo
Manual roots for ploužit#V????--??-??I??:	
--

Automatic roots for diskuze#NNF??-----A---?:	diskut diskuz diskus
Manual roots for diskuze#NNF??-----A---?:	
--

Automatic roots for minout#V????--??-??P??:	míj minu minul minut mi minou
Manual roots for minout#V????--??-??P??:	
--

Automatic roots for los#NNI??-----A---?:	los losos lososov lososovit lososárn
Manual roots for los#NNI??-----A---?:	
--

Automatic roots for pěstovat#V????--??-??I??:	pěst pěstoun pěsteb pěstou pěstounk pěstounsk pěstuj
Manual roots for pěstovat#V????--??-??I??:	
--

Automatic roots for pasovat#V????--??-??B??:	pas
Manual roots for pasovat#V????--??-??B??:	
--

Automatic roots for přímý#AA???----??---?:	přím přim upřim pří upřimn upřím
Manual roots for přímý#AA???----??---?:	
--

Automatic roots for křapat#V????--??-??I??:	křáp křap křapl křaplav křapn křápl křapaj křapav křapk křapnu krapán
Manual roots for křapat#V????--??-??I??:	
--

Automatic roots for scan#NNI??-----A---?:	scan scann sken scanner skenerist sca skener scannuj skan ske
Manual roots for scan#NNI??-----A---?:	
--

Automatic roots for zdvihnout#V????--??-??P??:	dvih dviž dvi zdvih
Manual roots for zdvihnout#V????--??-??P??:	
--

Automatic roots for cvrkat#V????--??-??I??:	cvrk cvrč cvrčal cvrčk cvrkl
Manual roots for cvrkat#V????--??-??I??:	
--

Automatic roots for křoupat#V????--??-??I??:	křup křoup kř křupan křupa křupansk křupanstv křupink
Manual roots for křoupat#V????--??-??I??:	
--

Automatic roots for pružit#V????--??-??I??:	pruž pruh
Manual roots for pružit#V????--??-??I??:	
--

Automatic roots for věstit#V????--??-??I??:	věst věšt věš věs věštb věštc věštkyn věštír zvěšt
Manual roots for věstit#V????--??-??I??:	
--

Automatic roots for kvalifikovat#V????--??-??B??:	kvalifik kvalifikace kvalifikuj kvali diskvalifikač kvalifikač rekvalifikač kvalifikát
Manual roots for kvalifikovat#V????--??-??B??:	
--

Automatic roots for dar#NNI??-----A---?:	dar dár dárc dáreče
Manual roots for dar#NNI??-----A---?:	
--

Automatic roots for rock#NNIS?-----A----:	roč rak rocker rock ročník let roker výročn oholet napřesrok rockerk rockerčin roček výročí
Manual roots for rock#NNIS?-----A----:	
--

Automatic roots for vzdušit#V????--??-??P??:	duš dušň
Manual roots for vzdušit#V????--??-??P??:	
--

Automatic roots for Jozef#NNM??-----A---?:	Josef Josefin Josefín Jozefín josefín josef Josefík Jozefík Josif Jozíf József josefinsk Joz Josefinin Josefink Josefčin Jozef Józef Jozif Jozífe Jozífk Jósef Jósz Józ josefinismus jozefín
Manual roots for Jozef#NNM??-----A---?:	
--

Automatic roots for morální#AA???----??---?:	moral morál
Manual roots for morální#AA???----??---?:	
--

Automatic roots for Bůh#NNM??-----A---?:	bož božen bezbož božšť božn boh božň božšt Bů božněl
Manual roots for Bůh#NNM??-----A---?:	
--

Automatic roots for bezpečí#NNN??-----A---?:	bezpeč bez
Manual roots for bezpečí#NNN??-----A---?:	
--

Automatic roots for kumulovat#V????--??-??I??:	kumul kumulát akumul akumulátorov cumul akumulátork
Manual roots for kumulovat#V????--??-??I??:	
--

Automatic roots for vlékat#V????--??-??I??:	vlék vlík lík vl vlak vlek
Manual roots for vlékat#V????--??-??I??:	
--

Automatic roots for analysa#NNF??-----A---?:	analyz analyt analýz analys analytik ana analytič psychoanalitick analyzér
Manual roots for analysa#NNF??-----A---?:	
--

Automatic roots for kývnout#V????--??-??P??:	kyv ký kýv kejv ky protivýkyv
Manual roots for kývnout#V????--??-??P??:	
--

Automatic roots for oj#NNF??-----A---?:	voj oj vojn vojk ojnic ojnič vojničk voják vojand vojí vojín
Manual roots for oj#NNF??-----A---?:	
--

Automatic roots for telefon#NNI??-----A---?:	telefon tele telefonová telefonov telefonist telefonic telefonek telefón telefonizac telefoniza
Manual roots for telefon#NNI??-----A---?:	
--

Automatic roots for komuna#NNF??-----A---?:	komunis komuniz komun komunist komuna komou komouš
Manual roots for komuna#NNF??-----A---?:	
--

Automatic roots for kotel#NNI??-----A---?:	kotl kotlík koteln kotlin kotlař kotlář kote kotelničk kotelní kotelnic kotelnič kotelník kotlár kotlan
Manual roots for kotel#NNI??-----A---?:	
--

Automatic roots for synchron#NNI??-----A---?:	chron synchron synchroniza
Manual roots for synchron#NNI??-----A---?:	
--

Automatic roots for vykládat#V????--??-??I??:	klád klad kladač kladačsk vý
Manual roots for vykládat#V????--??-??I??:	
--

Automatic roots for škrábnout#V????--??-??P??:	škráb škrab
Manual roots for škrábnout#V????--??-??P??:	
--

Automatic roots for hmota#NNF??-----A---?:	hmot hmotn hmotň hmotař mělohmot hmota hmotář hmotněn hmotov
Manual roots for hmota#NNF??-----A---?:	
--

Automatic roots for baba#NNF??-----A---?:	bab báb babsk babice babin babiz babiznin babstv babušk babinec
Manual roots for baba#NNF??-----A---?:	
--

Automatic roots for fašizmus#NNI??-----A---?:	faš fašizmus monarchofašist fašisuj ne fašismus
Manual roots for fašizmus#NNI??-----A---?:	
--

Automatic roots for gradus#NNI??-----A---?:	grad gradu degradač gradac grada grád gradace graduac gradua
Manual roots for gradus#NNI??-----A---?:	
--

Automatic roots for nítit#V????--??-??I??:	něc níc nětl nět nít ně nícen
Manual roots for nítit#V????--??-??I??:	
--

Automatic roots for ratio#NNNS?-----A----:	racional racionál racioneln rac racionaliza racion ratio iracional racionalismus rationeln
Manual roots for ratio#NNNS?-----A----:	
--

Automatic roots for chraptit#V??????????????:	chrapt chraptěl chraplák chraptě chrapti chrapot chrap
Manual roots for chraptit#V??????????????:	
--

Automatic roots for demokracie#NNF??-----A---?:	demokrat demokratiza demokrac demo demokratič demokratic demokra
Manual roots for demokracie#NNF??-----A---?:	
--

Automatic roots for cvaknout#V????--??-??P??:	cvak
Manual roots for cvaknout#V????--??-??P??:	
--

Automatic roots for interpretovat#V????--??-??B??:	interpret interpretace interpretač interpretat interpreter interpretac interpreta
Manual roots for interpretovat#V????--??-??B??:	
--

Automatic roots for nitro#NNN??-----A---?:	nitř nitrn nitern nit zvnitř zvniterň nitr zvnitern niter nitře nitřk zvnitřka nitrá nitrác zvniterněl nitřn
Manual roots for nitro#NNN??-----A---?:	
--

Automatic roots for German#NNM??-----A---?:	german germán germanist German Germán Germani germanistik germanismus
Manual roots for German#NNM??-----A---?:	
--

Automatic roots for dmychat#V????--??-??I??:	dmych dmých dmychadl rozdmých zadmých
Manual roots for dmychat#V????--??-??I??:	
--

Automatic roots for dol#NNI??-----A---?:	dol důl do ďol důlk zlatodol dů
Manual roots for dol#NNI??-----A---?:	
--

Automatic roots for hoblovat#V????--??-??I??:	hobl hoblin
Manual roots for hoblovat#V????--??-??I??:	
--

Automatic roots for oblý#AA???----??---?:	ob obl oblen oblouk Ob voblouček obláz obluj oblin
Manual roots for oblý#AA???----??---?:	
--

Automatic roots for smrdět#V????--??-??I??:	smrád smrd smradlav smraď smrdut smrad smraďoch smra smrdin smraděn smrádl
Manual roots for smrdět#V????--??-??I??:	
--

Automatic roots for velhat#V????--??-??P??:	vlh vlhl velh vlhá
Manual roots for velhat#V????--??-??P??:	
--

Automatic roots for čachtat#V????--??-??I??:	čvacht čacht čachtaj čvachtaj čachtanice čvachtanice čvachtačk
Manual roots for čachtat#V????--??-??I??:	
--

Automatic roots for šero#NNN??-----A---?:	šeř šeřel šer šeře šera šerá šerav šeři
Manual roots for šero#NNN??-----A---?:	
--

Automatic roots for chrom#NNI??-----A---?:	chrom chromova chromen chromová chromit chromuj chróm chromov chromi
Manual roots for chrom#NNI??-----A---?:	
--

Automatic roots for lidnit#Vf--------A----:	lid lidň lidněn
Manual roots for lidnit#Vf--------A----:	
--

Automatic roots for mina#NNF??-----A---?:	min miň
Manual roots for mina#NNF??-----A---?:	
--

Automatic roots for plast#NNI??-----A---?:	plast plastik plastelín plastelin plasticit plastič plasti plastikace plasť
Manual roots for plast#NNI??-----A---?:	
--

Automatic roots for rytmus#NNI??-----A---?:	rytm arytmick rythmick rytmič rytmicit diskorytmus rytmus rytmick
Manual roots for rytmus#NNI??-----A---?:	
--

Automatic roots for setkat#V????--??-??P??:	tk ty tyk styk týk tý tkan tejk
Manual roots for setkat#V????--??-??P??:	
--

Automatic roots for brebtat#V????--??-??I??:	brept brebt blept zabrebt brebtaj breptaj vyblebt blebt zabrept zbrebt
Manual roots for brebtat#V????--??-??I??:	
--

Automatic roots for ideologie#NNF??-----A---?:	ideolog ideologic ideologič ideologizac ideologizmus ideologiz
Manual roots for ideologie#NNF??-----A---?:	
--

Automatic roots for pečovat#V????--??-??I??:	peč
Manual roots for pečovat#V????--??-??I??:	
--

Automatic roots for rejdit#V????--??-??I??:	rejd rejdi rejdař rejdič rejdišt
Manual roots for rejdit#V????--??-??I??:	
--

Automatic roots for stydět#V????--??-??I??:	stých styd stud styš stydlav sty nestyd stych stu stydk stydl stydlín
Manual roots for stydět#V????--??-??I??:	
--

Automatic roots for špek#NNI??-----A---?:	špik špek špekoun špe špíč
Manual roots for špek#NNI??-----A---?:	
--

Automatic roots for žár#NNI??-----A---?:	žár žárn požár požárnic požárnič žář halogenk autožár
Manual roots for žár#NNI??-----A---?:	
--

Automatic roots for distribuce#NNF??-----A---?:	distribu distribut distribuce distributor distribuuj distributork distribuč dis distributorsk redistribuč
Manual roots for distribuce#NNF??-----A---?:	
--

Automatic roots for drát#V????--??-??I??:	dr drav dír dra dran drá der dravc draveč dračk
Manual roots for drát#V????--??-??I??:	
--

Automatic roots for jitřit#V????--??-??I??:	jitř jitřel jítř
Manual roots for jitřit#V????--??-??I??:	
--

Automatic roots for koupat#V????--??-??I??:	koup koupel koupeln koupadl koupališt koupelničk
Manual roots for koupat#V????--??-??I??:	
--

Automatic roots for krákat#V????--??-??I??:	krák krákor
Manual roots for krákat#V????--??-??I??:	
--

Automatic roots for přistoupit#V????--??-??P??:	stup stupň stupn stoup
Manual roots for přistoupit#V????--??-??P??:	
--

Automatic roots for transformovat#V????--??-??B??:	transform transformač trans transformátorov traf
Manual roots for transformovat#V????--??-??B??:	
--

Automatic roots for vrap#NNI??-----A---?:	rap vrap vráp
Manual roots for vrap#NNI??-----A---?:	
--

Automatic roots for vykat#V????--??-??I??:	ka ká kl kac kajíc knu knou knut vykovk káv kn
Manual roots for vykat#V????--??-??I??:	
--

Automatic roots for víra#NNF??-----A---?:	věr vír věrečn věreck věrc věrectv věrec
Manual roots for víra#NNF??-----A---?:	
--

Automatic roots for šolichat#V????--??-??I??:	šolich šolích
Manual roots for šolichat#V????--??-??I??:	
--

Automatic roots for -poli-#Affixoid:	monopoliz monopolist monopol mono monopoliza  monopolizmus monopolismus monopól
Manual roots for -poli-#Affixoid:	
--

Automatic roots for bodnout#V????--??-??P??:	bod bodl bodáv bodá
Manual roots for bodnout#V????--??-??P??:	
--

Automatic roots for clonit#V????--??-??I??:	clon cloň clán
Manual roots for clonit#V????--??-??I??:	
--

Automatic roots for filozofie#NNF??-----A---?:	filozof filosof filozofic filosofick filo filozofič náboženskofilozofick filosofová filosofuj
Manual roots for filozofie#NNF??-----A---?:	
--

Automatic roots for globální#AA???----??---?:	global globaliza glob globalismus globál
Manual roots for globální#AA???----??---?:	
--

Automatic roots for křtít#V????--??-??I??:	křt křest kř
Manual roots for křtít#V????--??-??I??:	
--

Automatic roots for migrovat#V????--??-??I??:	migr migrant imigrač migrač migrace migruj imigrantsk
Manual roots for migrovat#V????--??-??I??:	
--

Automatic roots for militarní#AA???----??---?:	militar militarist milit militariza militarizmus militarismus militariz militár
Manual roots for militarní#AA???----??---?:	
--

Automatic roots for parazit#NNM??-----A---?:	paraz parazit parazitick parazitár parazitizmus parazitová parazitikum parazitismus parazituj parasitár parazitóz exoparazit
Manual roots for parazit#NNM??-----A---?:	
--

Automatic roots for plácnout#V????--??-??P??:	plác
Manual roots for plácnout#V????--??-??P??:	
--

Automatic roots for rozhodit#V????--??-??P??:	hod haz hoz ho
Manual roots for rozhodit#V????--??-??P??:	
--

Automatic roots for sekera#NNF??-----A---?:	sekyr sekern seker sekyrn sekýrn sekerk sekyrk sekyrečk sekernič sekerárn sekyrárn
Manual roots for sekera#NNF??-----A---?:	
--

Automatic roots for ventil#NNI??-----A---?:	ventil ventilač ventilac ventiluj ventilk ventilát ventilátorek ventilátorov term
Manual roots for ventil#NNI??-----A---?:	
--

Automatic roots for šaty#NNIP?-----A---?:	šac šat šatn šatečk šatičk šatničk šatník šatstv
Manual roots for šaty#NNIP?-----A---?:	
--

Automatic roots for špion#NNM??-----A---?:	špion špión špionáž špió cifršpion
Manual roots for špion#NNM??-----A---?:	
--

Automatic roots for automat#NNI??-----A---?:	mat automat automatiza automatizmus
Manual roots for automat#NNI??-----A---?:	
--

Automatic roots for bízet#Vf--------A----:	bíz bíd bízečk
Manual roots for bízet#Vf--------A----:	
--

Automatic roots for dál#Db-------------:	dál dal dálnič dalš nadál
Manual roots for dál#Db-------------:	
--

Automatic roots for hlavička#NNF??-----A---?:	hlav
Manual roots for hlavička#NNF??-----A---?:	
--

Automatic roots for jiný#AA???----??---?:	jinač jin jina jinoš jinoch jinak nejináče jinače jind jináč jinš
Manual roots for jiný#AA???----??---?:	
--

Automatic roots for komise#NNF??-----A---?:	komisař komision komis komisioneln komisionál komisiv komisar komisark komisár komisariát komisn disciplin
Manual roots for komise#NNF??-----A---?:	
--

Automatic roots for mail#NNI??-----A---?:	mail email mailing mejl mailuj mejluj mej
Manual roots for mail#NNI??-----A---?:	
--

Automatic roots for marný#A????----??---?:	marn marň mar
Manual roots for marný#A????----??---?:	
--

Automatic roots for mysl#NNF??-----A---?:	mysl mysln nadsmysl bezesmysln zú
Manual roots for mysl#NNF??-----A---?:	
--

Automatic roots for ochota#NNF??-----A---?:	ochot ochoč ochotnič
Manual roots for ochota#NNF??-----A---?:	
--

Automatic roots for prognoza#NNF??-----A---?:	prognóz prognoz prognostik prognost prognosť prognosti
Manual roots for prognoza#NNF??-----A---?:	
--

Automatic roots for sexus#NNI??-----A---?:	sexual sexuál sexu antisexual sexualismus
Manual roots for sexus#NNI??-----A---?:	
--

Automatic roots for skladnit#Vf--------A----:	sklad skladn
Manual roots for skladnit#Vf--------A----:	
--

Automatic roots for zerzavý#AA???----??---?:	zrz zerz zrzl zerzoun zrzoun zerzav zrzoune zrzounk
Manual roots for zerzavý#AA???----??---?:	
--

Automatic roots for -log-#Affixoid:	sémiolog algolog mammologick metrolog metrologick organolog molog mologick semitolog tribologick  balkanolog bronchologi gnoseologi karpologi mammologi praxeologi tribologi
Manual roots for -log-#Affixoid:	
--

Automatic roots for Arabia#NNF??-----A---?:	arab arabsk Arab arabštin arabist Aráb Arabi arabizace arabiz arabik arabistik celoarabsk
Manual roots for Arabia#NNF??-----A---?:	
--

Automatic roots for Sparta#NNF??-----A---?:	spartakiád spartán sparť sparťa sparťan spartan sparťansk Spart Spartak Spartakus Sparťa Sparť Sparťan spartansk Spartan spartičk spart
Manual roots for Sparta#NNF??-----A---?:	
--

Automatic roots for byrokracie#NNF??-----A---?:	byrokrat byrokrac byro byrokratizmus
Manual roots for byrokracie#NNF??-----A---?:	
--

Automatic roots for chlemtat#V????--??-??I??:	chlem chlemt chlamst chlamstnu chlemtav chlamstnut schlemstn chlemst chlemtaj chlemta chlamsta
Manual roots for chlemtat#V????--??-??I??:	
--

Automatic roots for dik#NNM??-----A---?:	děk děč dik dě
Manual roots for dik#NNM??-----A---?:	
--

Automatic roots for dotovat#V????--??-??B??:	dot dotova dotač dotuj dotace
Manual roots for dotovat#V????--??-??B??:	
--

Automatic roots for kdy#Db-------------:	kd ku kdekoli kdepak kdepák kdežpak vodnikud ka vod kdes kdesi kdys kdysi kdyže kdejš dy da dá
Manual roots for kdy#Db-------------:	
--

Automatic roots for kolej#NNF??-----A---?:	kolej kolejnic kolejnič kolejničk kolejn bezkolejn
Manual roots for kolej#NNF??-----A---?:	
--

Automatic roots for mihat#V????--??-??I??:	míh mih mihot mihnu mihotav mihaj mihan mihotaj mihota mihul mihá
Manual roots for mihat#V????--??-??I??:	
--

Automatic roots for přemýšlet#V????--??-??I??:	mýšl mýšlen mýšle myšl mýšliv mejšle mýšlej mejšlen mýšlitel mejšl
Manual roots for přemýšlet#V????--??-??I??:	
--

Automatic roots for přestoupit#V????--??-??P??:	stup stoup stupn stupk stupc stupeče
Manual roots for přestoupit#V????--??-??P??:	
--

Automatic roots for special#NNI??-----A---?:	special speciál specieln specializa specialis špecial speci
Manual roots for special#NNI??-----A---?:	
--

Automatic roots for zajikat#V????--??-??I??:	jík jik jikav jikl jika jikajíc
Manual roots for zajikat#V????--??-??I??:	
--

Automatic roots for Martin#NNI??-----A---?:	Martin Marcin Martyn Martušk Martine Martink martinů Marcinek Martinek Martyne Marti martink Martinc
Manual roots for Martin#NNI??-----A---?:	
--

Automatic roots for ekonomie#NNF??-----A---?:	ekonom ekonomič eko
Manual roots for ekonomie#NNF??-----A---?:	
--

Automatic roots for fabulovat#V????--??-??I??:	fabul fabulát
Manual roots for fabulovat#V????--??-??I??:	
--

Automatic roots for fantazie#NNF??-----A---?:	fantazír fantaz fantast fantask fantastič fanta fantastik fantazma
Manual roots for fantazie#NNF??-----A---?:	
--

Automatic roots for fotografovat#V????--??-??I??:	foto
Manual roots for fotografovat#V????--??-??I??:	
--

Automatic roots for humanizmus#NNI??-----A---?:	human humanist humaniza
Manual roots for humanizmus#NNI??-----A---?:	
--

Automatic roots for infikovat#V????--??-??B??:	fik fikuj fikát fikace
Manual roots for infikovat#V????--??-??B??:	
--

Automatic roots for klapnout#V????--??-??P??:	klap
Manual roots for klapnout#V????--??-??P??:	
--

Automatic roots for konkurovat#V????--??-??I??:	konkuren konkurent konkur konkurenc konkureč kon konkurentsk
Manual roots for konkurovat#V????--??-??I??:	
--

Automatic roots for kvik#NNI??-----A---?:	kvik kvík kviko
Manual roots for kvik#NNI??-----A---?:	
--

Automatic roots for man#NNM??-----A---?:	man mansk maň manstv maněn manštin ma mank
Manual roots for man#NNM??-----A---?:	
--

Automatic roots for pakovat#V????--??-??I??:	pak
Manual roots for pakovat#V????--??-??I??:	
--

Automatic roots for pulz#NNI??-----A---?:	pul pulz puls pulsar pulza pulzar
Manual roots for pulz#NNI??-----A---?:	
--

Automatic roots for zrcadlo#NNN??-----A---?:	zrcadl zrcadli zrcadlen zrcát zrc zrcadliv zrcadlovin zrcadlár zrcadél
Manual roots for zrcadlo#NNN??-----A---?:	
--

Automatic roots for štuk#NNI??-----A---?:	štuk štukatér
Manual roots for štuk#NNI??-----A---?:	
--

Automatic roots for Alpy#NNFP?-----A---?:	alpin alpsk alpink alpínk alpinist alp Alp alpinium alpinum alpínum alpinismus alpín
Manual roots for Alpy#NNFP?-----A---?:	
--

Automatic roots for Eros#NNI??-----A---?:	erot Eros erotic erotič eros eró erotik erotizmus erotismus erotiz erosenk eroti
Manual roots for Eros#NNI??-----A---?:	
--

Automatic roots for banka#NNF??-----A---?:	bank bankéř dvacetieur bankéřk bankéřsk
Manual roots for banka#NNF??-----A---?:	
--

Automatic roots for bystrý#AA???----??---?:	bystř bystrouš bystr bystřin velebystr zbystra
Manual roots for bystrý#AA???----??---?:	
--

Automatic roots for chcát#V????--??-??I??:	chcá chc chca chcan sc chcank chcane chcán
Manual roots for chcát#V????--??-??I??:	
--

Automatic roots for homologie#NNF??-----A---?:	homolog homologick homologač homologizace homologiz homologace
Manual roots for homologie#NNF??-----A---?:	
--

Automatic roots for komín#NNI??-----A---?:	komín komin Komín kominic komí Komí Komínk kominí kominič kominík komeníč kominíč komínek
Manual roots for komín#NNI??-----A---?:	
--

Automatic roots for kočí#NNMP?-----A---?:	kočír koč kočov kočovn
Manual roots for kočí#NNMP?-----A---?:	
--

Automatic roots for křídlo#NNN??-----A---?:	křídl kříd křidél křidýlk křídel křídelní křídelnic křídelník křídlovk křídlen
Manual roots for křídlo#NNN??-----A---?:	
--

Automatic roots for lysý#AA???----??---?:	lys lysal lysin lyseck lysk
Manual roots for lysý#AA???----??---?:	
--

Automatic roots for manager#NNI??-----A---?:	manažer manager manažerk manažér managerk managerčin
Manual roots for manager#NNI??-----A---?:	
--

Automatic roots for metr#NNI??-----A---?:	metr metráž milimetr barometr kilometr barometrick hygrometr metrick kilák
Manual roots for metr#NNI??-----A---?:	
--

