Dynda	1	Dynda	Dynd a	FIXME_DIFFERENT	Dynd a	
stripovatelný	1	strip ov a teln ý	strip ova teln ě	FIXME_SD_WRONG_LEMMA	strip ova teln ý	
skompresovatelný	1	s kom pres ov a teln ý	s kom přes ova teln ý	FIXME_SD_WRONG_LEMMA	s kom pres ova teln ý	
rozkompresovatelný	1	roz kom pres ov a teln ý	roz kom přes ova teln ý	FIXME_SD_WRONG_LEMMA	roz kom pres ova teln ý	
zpolitisovatelný	0	z politis ov a teln ý	z polit is ova teln ý	FIXME_DIFFERENT	z polit isova teln ý	
temporalizovatelný	1	temporal iz ov a teln ý	?	FIXME_SD_QUESTIONMARK	tempor al izova teln ý	
sesynchronizovatelný	1	se syn chr on iz ov a teln ý	se syn chron iz ova teln ý	FIXME_DIFFERENT	se syn chron izova teln ý	
prohloubitelný	0	pro hloub i teln ý	pro hloub i teln ý	OK_IDENTICAL	pro hloub i teln ý	
přičouditelný	0	při čoud i teln ý	při čoud i teln ý	OK_IDENTICAL	při čoud i teln ý	
vytrolitelný	0	vy trol i teln ý	vy trol i teln ý	OK_IDENTICAL	vy trol i teln ý	
odkřesťanitelný	0	od křesť an i teln ý	od křesť an i teln ý	OK_IDENTICAL	od křesť an i teln ý	
zešimlovatitelný	0	ze šiml ov at i teln ý	ze šiml ova t i teln ý	FIXME_DIFFERENT	ze šiml ova t i teln ý	
jevitelný	0	jev i teln ý	jev i teln ý	OK_IDENTICAL	jev i teln ý	
úžitelný	0	ú žit eln ý	u ži t eč n ý	FIXME_SD_WRONG_LEMMA	úž i teln ý	
vobléknutelný	0	v oblék nu teln ý	?	FIXME_SD_QUESTIONMARK	v ob lék nu teln ý	
ztlápnutelný	0	z tláp nu teln ý	z tláp nu teln ý	OK_IDENTICAL	z tláp nu teln ý	
vstoupnutelný	0	v stoup nu teln ý	v stoup nu teln ý	OK_IDENTICAL	v stoup nu teln ý	
červenosemenný	0	červ en o semen n ý	červen o sem en n ý	FIXME_DIFFERENT	červen o semen n ý	??? červ samostatný morfém, protože barvivo z červů
bezpředmětný	0	bez předmět n ý	bez před mět n ý	FIXME_DIFFERENT	bez před mět n ý	
nenasytný	1	ne na syt n ý	ne na syt n ý	OK_IDENTICAL	ne na syt n ý	
tmavobarevný	0	tmav o barev n ý	tmav o barev n ý	OK_IDENTICAL	tmav o barev n ý	
Plandry	1	Plandry	Plandr y	FIXME_DIFFERENT	Plandr y	
zelenošedomodrý	0	zelen o šed o modr ý	zelen o šed o modr ý	OK_IDENTICAL	zelen o šed o modr ý	
louhovatý	0	louh o va t ý	louh ovat ý	FIXME_DIFFERENT	louh ovat ý	
černosrstý	0	čern o srst ý	čern o srst ý	OK_IDENTICAL	čern o srst ý	
podtrhnutý	0	pod trh nu t ý	pod trh nu t ý	OK_IDENTICAL	pod trh nu t ý	
vytuhnutý	0	vy tuh nu t ý	vy tuh nu t ý	OK_IDENTICAL	vy tuh nu t ý	
Halévy	0	Halévy	Halév y	FIXME_DIFFERENT	Halév y	
oděvuchtivý	0	oděv u chti v ý	o děv u ch iv ý	FIXME_SD_WRONG_LEMMA	o děv u cht iv ý	
zpěvuchtivý	0	z pěv u chti v ý	zpěv u ch iv ý	FIXME_SD_WRONG_LEMMA	z pěv u cht iv ý	
půlmiliardový	1	půl miliard ov ý	půl miliard ov ý	OK_IDENTICAL	půl miliard ov ý	
reliéfový	1	reliéf ov ý	reliéf ov ý	OK_IDENTICAL	reliéf ov ý	
předtuchový	0	před tuch ov ý	před tuch ov ý	OK_IDENTICAL	před tuch ov ý	
paládiový	1	paládi ov ý	?	FIXME_SD_QUESTIONMARK	paládi ov ý	
jednotrubkový	0	jedn o trub k ov ý	jedn o trub k ov ý	OK_IDENTICAL	jedn o trub k ov ý	
superšpičkový	1	super špič k ov ý	super špič k ov ý	OK_IDENTICAL	super špič k ov ý	
celohliníkový	0	cel o hlin ík ov ý	cel o hlin ík ov ý	OK_IDENTICAL	cel o hlin ík ov ý	
dvourámkový	0	dvou rám k ov ý	dv ou rám k ov ý	FIXME_DIFFERENT	dv ou rám k ov ý	
strunkový	1	strun k ov ý	strun k ov ý	OK_IDENTICAL	strun k ov ý	
kyslíkoniklový	0	kys l ík o nikl ov ý	kysl ík o nikl ov ý	FIXME_DIFFERENT	kysl ík o nikl ov ý	
vrásnozlomový	0	vrás n o zlom ov ý	vrásn o z lom ov ý	FIXME_DIFFERENT	vrás n o z lom ov ý	
zahumnový	0	za humn ov ý	za humn ov ý	OK_IDENTICAL	za humn ov ý	
bezfreonový	1	bez freon ov ý	bez freon ov ý	OK_IDENTICAL	bez freon ov ý	
čtyřistatunový	0	čtyř i sta tun ov ý	čtyř i st a tun ov ý	FIXME_DIFFERENT	čtyř i st a tun ov ý	
padesátilibrový	0	pa desát i libr ov ý	pa desát i libr ov ý	OK_IDENTICAL	pa desát i libr ov ý	
trojkomorový	0	troj komor ov ý	tr oj komor ov ý	FIXME_DIFFERENT	tr oj komor ov ý	
eternitový	0	eternit ov ý	?	FIXME_SD_QUESTIONMARK	eternit ov ý	
skorokonkurz	1	skoro konkurz	skoro konkurz	OK_IDENTICAL	skoro konkurz	
